"Sport","Cycling: Bernal all but wraps up maiden Colombian Tour title","https://www.channelnewsasia.com/news/sport/cycling-bernal-all-but-wraps-up-maiden-colombian-tour-title-11759454","Sport-articles/articles716.html"
"Sport","Swimming: Dressel treble after nightclub deaths rock world swim championships","https://www.channelnewsasia.com/news/sport/swimming-dressel-treble-after-nightclub-deaths-rock-world-swim-11759402","Sport-articles/articles717.html"
"Sport","Formula 1: Hamilton sweeps to German pole after Ferrari falter","https://www.channelnewsasia.com/news/sport/formula-1-hamilton-sweeps-to-german-pole-after-ferrari-falter-11759408","Sport-articles/articles718.html"
"Sport","Formula 1: Mick Schumacher thrills crowd in his father's Ferrari  ","https://www.channelnewsasia.com/news/sport/formula-1-mick-schumacher-thrills-crowd-in-his-father-s-ferrari-11759336","Sport-articles/articles719.html"
"Sport","Football: Valverde backs Griezmann to connect with Messi, Suarez","https://www.channelnewsasia.com/news/sport/football-valverde-backs-griezmann-to-connect-with-messi-suarez-11759346","Sport-articles/articles720.html"
"Sport","Football: Tottenham, Arsenal to splash cash on Premier League deadline day","https://www.channelnewsasia.com/news/sport/football-tottenham-arsenal-to-splash-cash-on-premier-league-11793642","Sport-articles/articles721.html"
"Sport","Motor racing: Former F1 driver Hartley to race in Formula E","https://www.channelnewsasia.com/news/sport/motor-racing-former-f1-driver-hartley-to-race-in-formula-e-11793476","Sport-articles/articles722.html"
"Singapore","Mediacorp partners beIN SPORTS to bring football and rugby action to Toggle","https://www.channelnewsasia.com/news/singapore/mediacorp-toggle-football-champions-league-rugby-bein-sports-11793382","Sport-articles/articles723.html"
"Sport","Football: Redmond commits future to Southampton until 2023","https://www.channelnewsasia.com/news/sport/football-redmond-commits-future-to-southampton-until-2023-11793404","Sport-articles/articles724.html"
"Sport","India may seek neutral venue for Davis Cup tie against Pakistan","https://www.channelnewsasia.com/news/sport/india-may-seek-neutral-venue-for-davis-cup-tie-against-pakistan-11793114","Sport-articles/articles725.html"
"Sport","Inter sign striker Lukaku from Manchester United","https://www.channelnewsasia.com/news/sport/football-lukaku-in-milan-ahead-of-probable-inter-move-11792868","Sport-articles/articles726.html"
"Sport","Rugby: Australia's O'Connor: From golden boy to bad boy, and back again","https://www.channelnewsasia.com/news/sport/rugby-australia-s-o-connor-from-golden-boy-to-bad-boy-and-back-11792766","Sport-articles/articles727.html"
"Sport","Tennis: Serena wins first match since Wimbledon final, Osaka advances","https://www.channelnewsasia.com/news/sport/tennis-serena-wins-first-match-since-wimbledon-final-osaka-11792762","Sport-articles/articles728.html"
"Sport","Athletics: India sprinter Chand signs two-year deal with Puma","https://www.channelnewsasia.com/news/sport/athletics--india-sprinter-chand-signs-two-year-deal-with-puma-11792086","Sport-articles/articles729.html"
"Sport","Rugby: Australia summon ghosts of triumphs past for All Blacks clash","https://www.channelnewsasia.com/news/sport/rugby--australia-summon-ghosts-of-triumphs-past-for-all-blacks-clash-11792046","Sport-articles/articles730.html"
"Sport","Formula 1: Red Bull set record for fastest F1 pitstop","https://www.channelnewsasia.com/news/sport/formula-1-red-bull-set-record-for-fastest-f1-pitstop-11764180","Sport-articles/articles731.html"
"Sport","Swimming: American Vollmer announces retirement from competing","https://www.channelnewsasia.com/news/sport/swimming--american-vollmer-announces-retirement-from-competing-11764082","Sport-articles/articles732.html"
"Sport","Football: Algeria to begin Cup of Nations title defence by hosting Zambia","https://www.channelnewsasia.com/news/sport/football-algeria-to-begin-cup-of-nations-title-defence-by-11763962","Sport-articles/articles733.html"
"Sport","Golf: Woods' US PGA event gets status boost to invitational","https://www.channelnewsasia.com/news/sport/golf-woods-us-pga-event-gets-status-boost-to-invitational-11763942","Sport-articles/articles734.html"
"Sport","Solskjaer's son in Kristiansund squad for Man United friendly","https://www.channelnewsasia.com/news/sport/solskjaer-s-son-in-kristiansund-squad-for-man-united-friendly-11763702","Sport-articles/articles735.html"
"Sport","Talk of rift with Rohit 'baffling', says Kohli","https://www.channelnewsasia.com/news/sport/talk-of-rift-with-rohit--baffling---says-kohli-11763620","Sport-articles/articles736.html"
"Sport","Germany likely to drop off F1 calendar despite crazy race","https://www.channelnewsasia.com/news/sport/germany-likely-to-drop-off-f1-calendar-despite-crazy-race-11763502","Sport-articles/articles737.html"
"Sport","EFL give Bolton and Bury Monday deadline to prove financial viability","https://www.channelnewsasia.com/news/sport/efl-give-bolton-and-bury-monday-deadline-to-prove-financial-viability-11763488","Sport-articles/articles738.html"
"Sport","Cricket: Ben Stokes proud to be England Test vice-captain again","https://www.channelnewsasia.com/news/sport/cricket-ben-stokes-proud-to-be-england-test-vice-captain-again-11763400","Sport-articles/articles739.html"
"Sport","Motor racing: Truck crash adds to Renault's bad weekend","https://www.channelnewsasia.com/news/sport/motor-racing--truck-crash-adds-to-renault-s-bad-weekend-11763448","Sport-articles/articles740.html"
"Sport","Track and field: Dalilah Muhammad smashes women's 400m hurdles world record","https://www.channelnewsasia.com/news/sport/track-and-field-dalilah-muhammad-smashes-women-s-400m-hurdles-11761454","Sport-articles/articles741.html"
"Sport","Tennis: 'Coco' makes Washington main draw, will face Diyas in first round","https://www.channelnewsasia.com/news/sport/tennis---coco--makes-washington-main-draw--will-face-diyas-in-first-round-11761428","Sport-articles/articles742.html"
"Sport","US teen wins US$3 million at video game tournament Fortnite World Cup","https://www.channelnewsasia.com/news/sport/fortnite-world-cup-bugha-11761396","Sport-articles/articles743.html"
"Sport","De Minaur near-perfect on serve to win Atlanta Open","https://www.channelnewsasia.com/news/sport/de-minaur-near-perfect-on-serve-to-win-atlanta-open-11761374","Sport-articles/articles744.html"
"Sport","Golf: Koepka surges to three-stroke victory at WGC St Jude","https://www.channelnewsasia.com/news/sport/golf-koepka-surges-to-three-stroke-victory-at-wgc-st-jude-11761364","Sport-articles/articles745.html"
"Sport","Koepka dominates one-sided bout with McIlroy in Memphis","https://www.channelnewsasia.com/news/sport/koepka-dominates-one-sided-bout-with-mcilroy-in-memphis-11761342","Sport-articles/articles746.html"
"Sport","Formula 1: 'It was karma', says Mercedes boss after German GP flop","https://www.channelnewsasia.com/news/sport/formula-1-it-was-karma-says-mercedes-boss-after-german-gp-flop-11761306","Sport-articles/articles747.html"
"Sport","Flamengo beat Botafogo 3-2 in fiery Rio derby","https://www.channelnewsasia.com/news/sport/flamengo-beat-botafogo-3-2-in-fiery-rio-derby-11761310","Sport-articles/articles748.html"
"Sport","Football: Benfica make it three wins from three in pre-season tournament","https://www.channelnewsasia.com/news/sport/football-benfica-make-it-three-wins-from-three-in-pre-season-11761294","Sport-articles/articles749.html"
"Sport","Equestrian: Olympic eventing great Todd announces retirement","https://www.channelnewsasia.com/news/sport/equestrian--olympic-eventing-great-todd-announces-retirement-11761272","Sport-articles/articles750.html"
"Sport","Marathon champion Soh Rui Yong's SEA Games nomination rejected","https://www.channelnewsasia.com/news/sport/snoc-rejects-marathoner-soh-rui-yong-nomination-sea-games-11773472","Sport-articles/articles751.html"
"Sport","Rugby: Gloucester scrumhalf Braley in Italy squad for World Cup warm-ups","https://www.channelnewsasia.com/news/sport/rugby--gloucester-scrumhalf-braley-in-italy-squad-for-world-cup-warm-ups-11773510","Sport-articles/articles752.html"
"Sport","Anderson leaves Edgbaston for scan on tight calf","https://www.channelnewsasia.com/news/sport/anderson-leaves-edgbaston-for-scan-on-tight-calf-11773406","Sport-articles/articles753.html"
"Sport","Alfa Romeo appeal German GP post-race penalties","https://www.channelnewsasia.com/news/sport/alfa-romeo-appeal-german-gp-post-race-penalties-11773354","Sport-articles/articles754.html"
"Sport","Smith century leads Australia recovery in Ashes opener","https://www.channelnewsasia.com/news/sport/smith-century-leads-australia-recovery-in-ashes-opener-11773316","Sport-articles/articles755.html"
"Sport","Haas F1 ready to rein in drivers after repeat clashes","https://www.channelnewsasia.com/news/sport/haas-f1-ready-to-rein-in-drivers-after-repeat-clashes-11773262","Sport-articles/articles756.html"
"Sport","Football: Bournemouth sign Dutch international Danjuma","https://www.channelnewsasia.com/news/sport/football-bournemouth-sign-dutch-international-danjuma-11773148","Sport-articles/articles757.html"
"Sport","Football: K League disappointed by Juve's response to alleged breach of contract","https://www.channelnewsasia.com/news/sport/football-k-league-disappointed-by-juve-s-response-to-alleged-11773134","Sport-articles/articles758.html"
"Sport","Football: Chinese clubs focus on run-in after Real dominated window","https://www.channelnewsasia.com/news/sport/chinese-super-league-clubs-focus-on-run-in-after-real-window-11773090","Sport-articles/articles759.html"
"Sport","No handshake as Australia win toss and bat at fortress Edgbaston","https://www.channelnewsasia.com/news/sport/no-handshake-as-australia-win-toss-and-bat-at-fortress-edgbaston-11773036","Sport-articles/articles760.html"
"Sport","Tennis: ITF 'satisfied' with Islamabad security plan as India advises more checks","https://www.channelnewsasia.com/news/sport/tennis-itf-satisfied-with-islamabad-security-plan-as-india-11804726","Sport-articles/articles761.html"
"Sport","Commonwealths firm on shooting exclusion despite India threat","https://www.channelnewsasia.com/news/sport/commonwealths-firm-on-shooting-exclusion-despite-india-threat-11804636","Sport-articles/articles762.html"
"Sport","Argentina World Cup winner Jose Luis Brown dies at 62","https://www.channelnewsasia.com/news/sport/argentina-world-cup-winner-jose-luis-brown-dies-at-62-11804356","Sport-articles/articles763.html"
"Sport","Boxing: Promoter defends Joshua's controversial Saudi date with Ruiz Jr","https://www.channelnewsasia.com/news/sport/boxing-promoter-defends-joshua-s-controversial-saudi-date-with-11803414","Sport-articles/articles764.html"
"Sport","Rugby: Jones ready for England 'family fall-out' at World Cup","https://www.channelnewsasia.com/news/sport/rugby-jones-ready-for-england-family-fall-out-at-world-cup-11803938","Sport-articles/articles765.html"
"Sport","Rugby: All Black Barrett cops three-week ban for shoulder charge red card","https://www.channelnewsasia.com/news/sport/rugby-all-black-barrett-cops-three-week-ban-for-shoulder-charge-11804098","Sport-articles/articles766.html"
"Sport","Cricket: New Zealand eye top Test ranking in Sri Lanka series","https://www.channelnewsasia.com/news/sport/cricket-new-zealand-eye-top-test-ranking-in-sri-lanka-series-11804174","Sport-articles/articles767.html"
"Sport","Football: Giuliano fires Al Nassr into AFC Champions League quarter-finals","https://www.channelnewsasia.com/news/sport/football-giuliano-fires-al-nassr-into-afc-champions-league-11803744","Sport-articles/articles768.html"
"Sport","Soccer: Markgraf named general manager of US women's team","https://www.channelnewsasia.com/news/sport/soccer--markgraf-named-general-manager-of-us-women-s-team-11803906","Sport-articles/articles769.html"
"Sport","Tennis-Murray won't play US Open singles after loss on return","https://www.channelnewsasia.com/news/sport/tennis-murray-won-t-play-us-open-singles-after-loss-on-return-11803902","Sport-articles/articles770.html"
"Singapore","S$12 million fund to help vulnerable persons gain access to sporting programmes","https://www.channelnewsasia.com/news/singapore/sportcares-fund-12-million-youths-seniors-persons-disabilities-11772620","Sport-articles/articles771.html"
"Sport","Football: Bielsa's Leeds target Premier League push as Championship starts","https://www.channelnewsasia.com/news/sport/football-bielsa-s-leeds-target-premier-league-push-as-11772526","Sport-articles/articles772.html"
"Sport","'Spree from the East': No Bale, but China resurgent in transfer market","https://www.channelnewsasia.com/news/sport/no-bale-but-china-resurgent-in-transfer-chinese-super-league-11772516","Sport-articles/articles773.html"
"Sport","Football: Heaton joins Villa from Burnley for undisclosed fee","https://www.channelnewsasia.com/news/sport/football-heaton-joins-villa-from-burnley-for-undisclosed-fee-11772672","Sport-articles/articles774.html"
"Sport","Lanka bench strength makes Karunaratne hopeful of fresh start","https://www.channelnewsasia.com/news/sport/lanka-bench-strength-makes-karunaratne-hopeful-of-fresh-start-11772564","Sport-articles/articles775.html"
"Sport","US women's league seeks World Cup-winning bounce","https://www.channelnewsasia.com/news/sport/us-women-s-league-seeks-world-cup-winning-bounce-11771620","Sport-articles/articles776.html"
"Sport","Rugby: All Black Sonny Bill lashes out at media critics","https://www.channelnewsasia.com/news/sport/rugby--all-black-sonny-bill-lashes-out-at-media-critics-11772308","Sport-articles/articles777.html"
"Sport","Andy Murray reunites with brother Jamie for doubles win","https://www.channelnewsasia.com/news/sport/andy-murray-reunites-with-brother-jamie-for-doubles-win-11771858","Sport-articles/articles778.html"
"Sport","Skateboarding: Young skaters challenge old dudes at Minneapolis X Games","https://www.channelnewsasia.com/news/sport/skateboarding--young-skaters-challenge-old-dudes-at-minneapolis-x-games-11772052","Sport-articles/articles779.html"
"Sport","Top seeds reign as Svitolina and Sabalenka advance in San Jose","https://www.channelnewsasia.com/news/sport/top-seeds-reign-as-svitolina-and-sabalenka-advance-in-san-jose-11771942","Sport-articles/articles780.html"
"Sport","Football: Community Shield win is perfect prep for Liverpool rivalry, says Guardiola","https://www.channelnewsasia.com/news/sport/football-community-shield-win-is-perfect-prep-for-liverpool-11780690","Sport-articles/articles781.html"
"Sport","Golf: Japan's Shibuno wins Women's British Open","https://www.channelnewsasia.com/news/sport/golf-japan-s-shibuno-wins-women-s-british-open-11780646","Sport-articles/articles782.html"
"Sport","Man City beat Liverpool on penalties to win Community Shield","https://www.channelnewsasia.com/news/sport/man-city-beat-liverpool-on-penalties-to-win-community-shield-11780642","Sport-articles/articles783.html"
"Sport","Football: De Bruyne says Man City, Liverpool not yet 'physically ready'","https://www.channelnewsasia.com/news/sport/football-de-bruyne-says-man-city-liverpool-not-yet-physically-11780540","Sport-articles/articles784.html"
"Sport","Football: City draw first blood against Liverpool with Community Shield win","https://www.channelnewsasia.com/news/sport/football-city-draw-first-blood-against-liverpool-with-community-11780520","Sport-articles/articles785.html"
"Sport","Motor Rally: Tanak wins in Finland, extends championship lead","https://www.channelnewsasia.com/news/sport/motor-rally-tanak-wins-in-finland-extends-championship-lead-11780192","Sport-articles/articles786.html"
"Sport","Football: Everton sign forward Kean from Juventus","https://www.channelnewsasia.com/news/sport/football-everton-sign-forward-kean-from-juventus-11780250","Sport-articles/articles787.html"
"Sport","Badminton: Taiwan's Chou wins thrilling Thailand Open","https://www.channelnewsasia.com/news/sport/badminton-taiwan-s-chou-wins-thrilling-thailand-open-11780334","Sport-articles/articles788.html"
"Sport","Formula 1: Hamilton wins in Hungary after hunting down Verstappen","https://www.channelnewsasia.com/news/sport/formula-1-hamilton-wins-in-hungary-after-hunting-down-verstappen-11780378","Sport-articles/articles789.html"
"Sport","Marquez wins Czech MotoGP for 50th premier class victory","https://www.channelnewsasia.com/news/sport/marquez-wins-czech-motogp-for-50th-premier-class-victory-11780310","Sport-articles/articles790.html"
"Sport","Serena, Osaka advance in Toronto to set up rematch","https://www.channelnewsasia.com/news/sport/serena--osaka-advance-in-toronto-to-set-up-rematch-11794562","Sport-articles/articles791.html"
"Sport","We want to stop South Africa winning title - Pumas captain","https://www.channelnewsasia.com/news/sport/we-want-to-stop-south-africa-winning-title---pumas-captain-11794550","Sport-articles/articles792.html"
"Sport","Tennis: Nadal and Federer to face Djokovic on crisis-hit ATP Council","https://www.channelnewsasia.com/news/sport/tennis-nadal-and-federer-to-face-djokovic-on-crisis-hit-atp-11794254","Sport-articles/articles793.html"
"Sport","Football: How the Premier League top six fared in the transfer window","https://www.channelnewsasia.com/news/sport/football-how-the-premier-league-top-six-fared-in-the-transfer-11794488","Sport-articles/articles794.html"
"Sport","Arsenal sign Brazilian defender Luiz from Chelsea","https://www.channelnewsasia.com/news/sport/arsenal-sign-brazilian-defender-luiz-from-chelsea-11794496","Sport-articles/articles795.html"
"Sport","Tennis: Pliskova reaches WTA Toronto quarter-finals","https://www.channelnewsasia.com/news/sport/tennis-pliskova-reaches-wta-toronto-quarter-finals-11794258","Sport-articles/articles796.html"
"Sport","Football: Resurgent Lo Celso ready to shine at Tottenham","https://www.channelnewsasia.com/news/sport/football-resurgent-lo-celso-ready-to-shine-at-tottenham-11794432","Sport-articles/articles797.html"
"Sport","Federer and Nadal return to ATP Player Council","https://www.channelnewsasia.com/news/sport/federer-and-nadal-return-to-atp-player-council-11794414","Sport-articles/articles798.html"
"Sport","United offload Lukaku, Spurs strengthen as window shuts","https://www.channelnewsasia.com/news/sport/united-offload-lukaku--spurs-strengthen-as-window-shuts-11794352","Sport-articles/articles799.html"
"Sport","Wexford Youths Women seek crowdfunding for Champions League campaign","https://www.channelnewsasia.com/news/sport/wexford-youths-women-seek-crowdfunding-for-champions-league-campaign-11794222","Sport-articles/articles800.html"
"Sport","Everton squad deeper but holes remain in defence, says Silva","https://www.channelnewsasia.com/news/sport/everton-squad-deeper-but-holes-remain-in-defence--says-silva-11796562","Sport-articles/articles801.html"
"Sport","Fairway to heaven? UK cathedral golf course draws fans","https://www.channelnewsasia.com/news/sport/fairway-to-heaven-uk-cathedral-golf-course-draws-fans-11796394","Sport-articles/articles802.html"
"Sport","Indian cricket board complies with national anti-doping agency","https://www.channelnewsasia.com/news/sport/indian-cricket-board-complies-with-national-anti-doping-agency-11796476","Sport-articles/articles803.html"
"Sport","Two guilty of taking photos of body of dead football player Sala","https://www.channelnewsasia.com/news/sport/two-guilty-of-taking-photos-of-body-of-dead-football-player-sala-11796290","Sport-articles/articles804.html"
"Sport","Jones to set appearance record for Wales","https://www.channelnewsasia.com/news/sport/jones-to-set-appearance-record-for-wales-11796256","Sport-articles/articles805.html"
"Sport","Lampard has faith in Chelsea youngsters","https://www.channelnewsasia.com/news/sport/lampard-has-faith-in-chelsea-youngsters-11796242","Sport-articles/articles806.html"
"Sport","Wales team to play England on Sunday","https://www.channelnewsasia.com/news/sport/wales-team-to-play-england-on-sunday-11796212","Sport-articles/articles807.html"
"Sport","Inter hand Icardi's number nine shirt to Lukaku","https://www.channelnewsasia.com/news/sport/inter-hand-icardi-s-number-nine-shirt-to-lukaku-11796204","Sport-articles/articles808.html"
"Sport","No passport, no travel for Wolves forward Traore","https://www.channelnewsasia.com/news/sport/no-passport--no-travel-for-wolves-forward-traore-11796070","Sport-articles/articles809.html"
"Sport","South Africa put Nkwe in charge for India tour","https://www.channelnewsasia.com/news/sport/south-africa-put-nkwe-in-charge-for-india-tour-11795976","Sport-articles/articles810.html"
"Sport","Football: Klopp says City showdown won't influence Liverpool's title bid","https://www.channelnewsasia.com/news/sport/football-klopp-says-city-showdown-won-t-influence-liverpool-s-11763392","Sport-articles/articles811.html"
"Sport","Football: Lukaku misses United's friendly trip amid transfer talk","https://www.channelnewsasia.com/news/sport/football-lukaku-misses-united-s-friendly-trip-amid-transfer-talk-11763278","Sport-articles/articles812.html"
"Sport","Football: Hurting Draxler hopes 'egos' can fire PSG in Europe","https://www.channelnewsasia.com/news/sport/football-hurting-draxler-hopes-egos-can-fire-psg-in-europe-11763314","Sport-articles/articles813.html"
"Sport","Show me the money: South Korea football fans to sue over Ronaldo benching","https://www.channelnewsasia.com/news/sport/south-korea-juventus-fans-sue-over-cristiano-ronaldo-benching-11763268","Sport-articles/articles814.html"
"Sport","Football: Former Man United defender Evra announces retirement","https://www.channelnewsasia.com/news/sport/football-former-man-united-defender-evra-announces-retirement-11763274","Sport-articles/articles815.html"
"Sport","Formula 1: Sick Hamilton aims to sleep off Hockenheim disappointment","https://www.channelnewsasia.com/news/sport/formula-1-sick-hamilton-aims-to-sleep-off-hockenheim-11763266","Sport-articles/articles816.html"
"Sport","Trial of strength at 2,000 metres altitude - Celtic wrestling in Austria","https://www.channelnewsasia.com/news/sport/trial-of-strength-at-2-000-metres-altitude---celtic-wrestling-in-austria-11763220","Sport-articles/articles817.html"
"Sport","Draw for African preliminaries for 2022 World Cup","https://www.channelnewsasia.com/news/sport/draw-for-african-preliminaries-for-2022-world-cup-11763172","Sport-articles/articles818.html"
"Sport","Rugby: Esterhuizen, Orie added to Bok squad for Argentina test","https://www.channelnewsasia.com/news/sport/rugby--esterhuizen--orie-added-to-bok-squad-for-argentina-test-11763082","Sport-articles/articles819.html"
"Sport","Wallabies must have more self-belief - former captain Eales","https://www.channelnewsasia.com/news/sport/wallabies-must-have-more-self-belief---former-captain-eales-11763048","Sport-articles/articles820.html"
"Sport","Rugby: Youngest Barrett re-signs with New Zealand to 2022","https://www.channelnewsasia.com/news/sport/rugby--youngest-barrett-re-signs-with-new-zealand-to-2022-11764560","Sport-articles/articles821.html"
"Sport","Rugby: Beale retained in Australia for another year","https://www.channelnewsasia.com/news/sport/rugby--beale-retained-in-australia-for-another-year-11764542","Sport-articles/articles822.html"
"Sport","Football: Brazil police end Neymar rape probe over lack of evidence","https://www.channelnewsasia.com/news/sport/football-brazil-police-end-neymar-rape-probe-over-lack-of-11764428","Sport-articles/articles823.html"
"Sport","Soccer: FA to introduce 'sin bins' in grassroots soccer to tackle dissent","https://www.channelnewsasia.com/news/sport/soccer--fa-to-introduce--sin-bins--in-grassroots-soccer-to-tackle-dissent-11764416","Sport-articles/articles824.html"
"Sport","Soccer: New York City FC reap rewards of shared Manchester City vision","https://www.channelnewsasia.com/news/sport/soccer--new-york-city-fc-reap-rewards-of-shared-manchester-city-vision-11764380","Sport-articles/articles825.html"
"Sport","Cricket: England have nothing to lose by opening with Roy","https://www.channelnewsasia.com/news/sport/cricket--england-have-nothing-to-lose-by-opening-with-roy-11764378","Sport-articles/articles826.html"
"Sport","Australia aim to pour cold water on England's summer","https://www.channelnewsasia.com/news/sport/australia-aim-to-pour-cold-water-on-england-s-summer-11764362","Sport-articles/articles827.html"
"Sport","Tennis: Tsitsipas gets top billing at Washington ATP event","https://www.channelnewsasia.com/news/sport/tennis-tsitsipas-gets-top-billing-at-washington-atp-event-11764332","Sport-articles/articles828.html"
"Sport","Football: Saudi Arabia appoint Renard as coach","https://www.channelnewsasia.com/news/sport/football-saudi-arabia-appoint-renard-as-coach-11764198","Sport-articles/articles829.html"
"Sport","Tennis: Sharapova, Venus get wildcards for WTA Cincinnati event","https://www.channelnewsasia.com/news/sport/tennis-sharapova-venus-get-wildcards-for-wta-cincinnati-event-11764158","Sport-articles/articles830.html"
"Sport","Del Potro withdraws from US Open as knee rehab continues","https://www.channelnewsasia.com/news/sport/del-potro-withdraws-from-us-open-as-knee-rehab-continues-11806758","Sport-articles/articles831.html"
"Sport","Ajax, Red Star through as Celtic and Porto crash out","https://www.channelnewsasia.com/news/sport/ajax--red-star-through-as-celtic-and-porto-crash-out-11806746","Sport-articles/articles832.html"
"Sport","Root expects England to come back strong at Lord's","https://www.channelnewsasia.com/news/sport/root-expects-england-to-come-back-strong-at-lord-s-11806744","Sport-articles/articles833.html"
"Sport","Football: Ajax see off PAOK to reach Champions League playoffs","https://www.channelnewsasia.com/news/sport/football-ajax-see-off-paok-to-reach-champions-league-playoffs-11806730","Sport-articles/articles834.html"
