"Uganda says malaria prevalence surges, cites climate change and refugees","World-articles-txt/articles452txt","14 Aug 2019 11:20PM","medical health,Uganda,malaria,Congo,World"
"Regime forces advance towards key town in northwest Syria","World-articles-txt/articles453txt","14 Aug 2019 11:20PM","air strike,Idlib,Syria,Turkey,World"
"Novartis replaces top scientists at Avexis after drug data manipulated","World-articles-txt/articles454txt","14 Aug 2019 11:16PM","medical health,gene therapy,Avexis,Novartis,World"
"Separatists' seizure of Aden makes Yemen government weaker than ever","World-articles-txt/articles455txt","14 Aug 2019 11:13PM","Yemen,Aden,politics,middle east,UAE,World"
"Teenage activist Greta takes climate campaign to the high seas","World-articles-txt/articles456txt","14 Aug 2019 11:05PM","Greta Thunberg,climate change,World"
"Medical abortions can be safely supervised via telemedicine: study","World-articles-txt/articles457txt","14 Aug 2019 10:35PM","telemedicine,Reuters Health,U.S.,health,Planned Parenthood,Julia Kohn,World"
"British PM sees 'collaboration' between anti-Brexit MPs, Brussels","World-articles-txt/articles458txt","14 Aug 2019 10:24PM","Brussels,United Kingdom,Brexit,Boris Johnson,World"
"France opens criminal probe into death of Irish girl in Malaysia","World-articles-txt/articles459txt","14 Aug 2019 09:56PM","Nora Quoirin,Malaysia,France,Asia"
"Turkish drones start operating in northern Syria: Ministry","World-articles-txt/articles460txt","14 Aug 2019 09:40PM","Turkey,Ankara,Syria,Washington,drone,military,World"
"Chinese and US trade negotiators speak on phone","World-articles-txt/articles461txt","13 Aug 2019 11:11PM","US China trade war,China,United States,Liu He,World"
"India says easing Kashmir restrictions 'in phased manner'  ","World-articles-txt/articles462txt","13 Aug 2019 10:37PM","Kashmir,news and politics,'in,India,Asia"
"Paris launches Notre-Dame lead decontamination work","World-articles-txt/articles463txt","13 Aug 2019 10:10PM","decontamination,news and politics,Paris,World"
"Trump backs off China tariff plan with delays for cellphones, laptops","World-articles-txt/articles464txt","13 Aug 2019 10:05PM","tariffs,Chinese imports,cellphones,laptops,consumer goods,Business"
"Poland's rights commissioner on faultlines of divided country","World-articles-txt/articles465txt","13 Aug 2019 09:52PM","horn-rimmed,news and politics,PiS,Adam Bodnar,World"
"Saudi-led coalition says Houthi drone 'fell' inside Yemen","World-articles-txt/articles466txt","13 Aug 2019 09:36PM","Saudi Arabia,Houthis,Yemen,drone,World"
"In new migrant standoff, Italy's Salvini blocks two NGO boats","World-articles-txt/articles467txt","13 Aug 2019 08:58PM","boat migrants,migrants,Matteo Salvini,Open Arms,World"
"Global measles cases triple year-on-year: WHO","World-articles-txt/articles468txt","13 Aug 2019 08:48PM","measles,WHO,health,World"
"Ukraine's president offers citizenship to Russian political refugees","World-articles-txt/articles469txt","13 Aug 2019 08:17PM","Ukraine,Volodymyr Zelenskiy,Kiev,Donbass,Russia,World"
"Gibraltar government source denies tanker will leave on Tuesday","World-articles-txt/articles470txt","13 Aug 2019 08:11PM","Gibraltar,Iran,Grace,British overseas territory,World"
"Man stabbed outside UK interior ministry","World-articles-txt/articles471txt","15 Aug 2019 10:25PM","United Kingdom,London,stabbing,crime,World"
"Thousands march in Yemen's Aden for independent south","World-articles-txt/articles472txt","15 Aug 2019 09:43PM","Yemen,World"
"Man treated for knife injuries near Home Office in London; 1 arrested","World-articles-txt/articles473txt","15 Aug 2019 09:07PM","London,Home Office,World"
"Libya capital flights suspended after deadly rocket fire","World-articles-txt/articles474txt","15 Aug 2019 08:13PM","Tripoli,Libya,World"
"Macron honours 'spirit of resistance' in WWII Provence landings","World-articles-txt/articles475txt","15 Aug 2019 08:12PM","Emmanuel Macron,France,World"
"Texas to execute man convicted of killing couple after carjacking","World-articles-txt/articles476txt","15 Aug 2019 07:48PM","Texas,crime,World"
"Tens of thousands rally in Yemen's Aden to support separatist takeover","World-articles-txt/articles477txt","15 Aug 2019 07:25PM","Aden,Yemenis,UAE,World"
"UK opposition seeks to oust PM to avoid no-deal Brexit","World-articles-txt/articles478txt","15 Aug 2019 07:17PM","Jeremy Corbyn,Brexit,Boris Johnson,World"
"US presidential candidate Cory Booker proposes office to fight white supremacy","World-articles-txt/articles479txt","15 Aug 2019 07:04PM","Cory Booker,Donald Trump,politics,United States,election,World"
"Taliban, US pact in Afghanistan could boost Islamic State","World-articles-txt/articles480txt","15 Aug 2019 06:56PM","Taliban,Afghanistan,United State,Islamic State,war,World"
"Clashes in Hong Kong’s old communist stronghold North Point highlight city’s polarisation","World-articles-txt/articles481txt","06 Aug 2019 08:52PM","Hong Kong,Hong Kong protests,China,Asia"
"Paris downplays Notre-Dame lead poisoning fears","World-articles-txt/articles482txt","06 Aug 2019 07:37PM","Paris,Notre-Dame,lead poisoning,toxic metal,World"
"Sierra Leone community's suit against diamond miner shows activist trend","World-articles-txt/articles483txt","06 Aug 2019 07:11PM","Sierra Leone,diamond,World"
"GSK ends development of Ebola vaccine, hands work to US institute","World-articles-txt/articles484txt","06 Aug 2019 07:11PM","GlaxoSmithKline,Marburg virus,medical health,Marburg,Ebola,GSK,World"
"In Lebanon, a monastery brings together Christians scattered by war","World-articles-txt/articles485txt","06 Aug 2019 07:09PM","Lebanon,Christianity,religion & spirituality,World"
"Pact is reached in Mozambique but prospects for peace still uncertain","World-articles-txt/articles486txt","06 Aug 2019 07:07PM","Mozambique,news and politics,World"
"Biden leads Democrats as minorities favor most electable candidate vs Trump: Reuters-Ipsos poll","World-articles-txt/articles487txt","06 Aug 2019 07:06PM","Bernie Sanders,Donald Trump,Joe Biden,news and politics,World"
"Erdogan says Trump will not allow ties to be held 'captive' to S-400 row","World-articles-txt/articles488txt","06 Aug 2019 07:04PM","Turkey,Donald Trump,news and politics,NATO,United States,World"
"'Ready and willing' to do a Brexit deal, Britain tells EU","World-articles-txt/articles489txt","06 Aug 2019 07:02PM","United Kingdom,Brexit,news and politics,Boris Johnson,European Union,World"
"Diabetes drug maker Novo Nordisk buys pill factory in North Carolina","World-articles-txt/articles490txt","06 Aug 2019 06:55PM","North Carolina,medical health,diabetes,Novo,World"
"Scientists hail promise of first effective Ebola treatments in Congo trial","World-articles-txt/articles491txt","12 Aug 2019 10:35PM","ZMapp,survival rate,medical health,Anthony Fauci,Congo,World"
"Regeneron's Ebola treatment proves superior to rival in trial","World-articles-txt/articles492txt","12 Aug 2019 10:26PM","Regeneron,news and politics,experimental,World"
"US records 10 new cases of measles last week","World-articles-txt/articles493txt","12 Aug 2019 10:00PM","United States,medical health,measles,World"
"Australia eyes rare earth deposits amid fears over China supplies","World-articles-txt/articles494txt","12 Aug 2019 07:27PM","business and finance,China,rare earth,Australia,World"
"Man, girl missing after violent storm in Switzerland: Police","World-articles-txt/articles495txt","12 Aug 2019 07:25PM","Switzerland,World"
"US adviser Bolton courts Brexit Britain with a trade deal talk","World-articles-txt/articles496txt","12 Aug 2019 07:24PM","Brexit,Donald Trump,European Union,Britain,United Kingdom,World"
"Italy to decide on government future after Salvini pullout","World-articles-txt/articles497txt","12 Aug 2019 07:23PM","Matteo Salvini,parliamentary,Italy,news and politics,opinion poll,M5S,World"
"Suspect in Norway mosque shooting not admitting guilt: Lawyer","World-articles-txt/articles498txt","12 Aug 2019 07:21PM","Norway,World"
"China's Ivy League dreams fuel lucrative admissions industry","World-articles-txt/articles499txt","12 Aug 2019 02:48PM","China,Britain,Unite States,Ivy League,education,Asia"
"Chinese firms learn to adapt as US trade war rages","World-articles-txt/articles500txt","12 Aug 2019 02:42PM","trade war,United States,China,Vietnam,Business"
"Iran says Britain might release oil tanker soon, Gibraltar says not yet","World-articles-txt/articles501txt","13 Aug 2019 07:44PM","Gibraltar,Iran,Grace,Fars news agency,automotive,Fars,World"
"Democrat Buttigieg unveils US$80 billion plan to bring internet to all rural Americans","World-articles-txt/articles502txt","13 Aug 2019 07:42PM","Pete Buttigieg,America,World"
"'Wanted': Macron farming MP targeted in latest French protest","World-articles-txt/articles503txt","13 Aug 2019 07:27PM","Jean-Baptiste Moreau,Emmanuel Macron,France,World"
"Deciphera's late-stage study meets main goal of preventing cancer progression","World-articles-txt/articles504txt","13 Aug 2019 07:15PM","Deciphera,GIST,stomach cancer,medical health,World"
"Climate campaigner Greta prepares to sail to US on boat with no toilet","World-articles-txt/articles505txt","13 Aug 2019 07:12PM","New York,sports,United States,Greta Thunberg,Atlantic,Swedish,World"
"Fuel-truck drivers in Portugal raise spectre of empty filling stations","World-articles-txt/articles506txt","13 Aug 2019 07:04PM","Portugal,World"
"Climate campaigner Greta Thunberg prepares to sail to the US to avoid flying","World-articles-txt/articles507txt","13 Aug 2019 06:36PM","Greta Thunberg,climate change,Malizia II,World"
"US President Trump asked Japan PM to buy farm products: Kyodo","World-articles-txt/articles508txt","13 Aug 2019 06:34PM","business and finance,U.S.,'huge,Kyodo,Japan,Trump,Business"
"Kremlin says protests in Moscow have not created a political crisis","World-articles-txt/articles509txt","13 Aug 2019 06:33PM","Kremlin,Moscow,Russia,World"
"Trump Jr touts 'dream' Indonesia projects, denies any conflicts","World-articles-txt/articles510txt","13 Aug 2019 06:26PM","Donald Trump Jr,Indonesia,Hary Tanoesoedibjo,Asia"
"Explosions in Afghanistan wound dozens on Independence Day","World-articles-txt/articles511txt","19 Aug 2019 04:51PM","Taliban,Afghanistan,Islamic State,World"
"Talks under way to close Australia's Manus detention camp","World-articles-txt/articles512txt","19 Aug 2019 04:38PM","immigration,Papua New Guinea,news and politics,Australia,Port Moresby,World"
"France's Macron to discuss Brexit with British PM Johnson","World-articles-txt/articles513txt","19 Aug 2019 04:33PM","Brexit,Emmanuel Macron,Boris Johnson,France,UK,World"
"Iran warns US against seizing tanker","World-articles-txt/articles514txt","19 Aug 2019 04:21PM","Gibraltar,Iran,news and politics,British overseas territory,World"
"China plans to make Shenzhen a 'better place' than Hong Kong ","World-articles-txt/articles515txt","19 Aug 2019 04:02PM","Hong Kong,China,Shenzhen,Asia"
"Britain's Prince Andrew 'appalled' by Epstein abuse claims","World-articles-txt/articles516txt","19 Aug 2019 03:41PM","sex trafficking,Prince Andrew,Jeffrey Epstein,World"
"Recall UK parliament to tackle Brexit crisis, opposition Labour Party says","World-articles-txt/articles517txt","19 Aug 2019 03:14PM","Brexit,UK,Labour Party,Jeremy Corbyn,World"
"Young Libyans chose danger at sea over peril at home","World-articles-txt/articles518txt","19 Aug 2019 02:37PM","Libya,migrants,World"
"Turkey replaces three pro-Kurdish party mayors for suspected militant links","World-articles-txt/articles519txt","19 Aug 2019 02:24PM","Turkey,Istanbul,Kurdistan Workers Party,World"
"Australia's Pacific role challenged in climate row","World-articles-txt/articles520txt","19 Aug 2019 01:43PM","Australia,climate change,Pacific islands,World"
"Commentary: London's bold vision as the world's first national city park","World-articles-txt/articles521txt","10 Aug 2019 01:32PM","smart city,smart nation,technology,green infrastructure,Commentary"
"Australian universities become battleground over Hong Kong protests","World-articles-txt/articles522txt","10 Aug 2019 12:28PM","Hong Kong protests,China,pro-democracy protests,Australia,World"
"US to China: Stop 'dangerous' media reports on diplomat in Hong Kong","World-articles-txt/articles523txt","10 Aug 2019 10:38AM","Hong Kong protests,China,news and politics,Asia"
"Rescue ship plucks 85 from the sea as Richard Gere shines light on migrant plight","World-articles-txt/articles524txt","10 Aug 2019 06:16AM","Ocean Viking,Richard Gere,Proactiva,Italy,news and politics,World"
"Mediterranean diet tied to lower risk of gestational diabetes","World-articles-txt/articles525txt","10 Aug 2019 06:05AM","U.K,Mediterranean diet,Shakila Thangaratinam,London,health,PLoS Medicine,World"
"Poop less for a cleaner planet, says Brazil's president","World-articles-txt/articles526txt","10 Aug 2019 05:23AM","business and finance,Jair Bolsonaro,INPE,Brazil,Amazon,deforestation,World"
"Late puberty may lead to weaker bones","World-articles-txt/articles527txt","10 Aug 2019 05:10AM","bone density,Ahmed Elhakeem,England,health,Robert Rapaport,BMI,World"
"Lifestyle stressed in cardiovascular disease prevention guideline","World-articles-txt/articles528txt","10 Aug 2019 05:10AM","American Heart Association,cardiovascular disease,Reuters Health,Blumenthal,health,American College of Cardiology,World"
"Major power cut hits homes, transport in parts of Britain","World-articles-txt/articles529txt","10 Aug 2019 04:58AM","automotive,power cut,Britain,England,Wales,National Grid,World"
"Texas shooting suspect told police he targeted 'Mexicans': Report","World-articles-txt/articles530txt","10 Aug 2019 04:42AM","Walmart,El Paso,Patrick Crusius,Texas,accused,news and politics,World"
"Myanmar battles rising floodwaters after landslide kills 52","World-articles-txt/articles531txt","11 Aug 2019 02:51PM","Myanmar,World"
"Brazilian judge orders release of ex-billionaire Batista","World-articles-txt/articles532txt","11 Aug 2019 02:30PM","Brazil,World"
"Saudi-led coalition moves against separatists who seized Aden in blow to alliance","World-articles-txt/articles533txt","11 Aug 2019 02:20PM","Yemen,World"
"Argentines head to polls for primary in first Macri, Fernandez showdown","World-articles-txt/articles534txt","11 Aug 2019 02:19PM","Argentina,World"
"Thousands rally in Romania on anniversary of violent protest","World-articles-txt/articles535txt","11 Aug 2019 02:15PM","Romania,European Union,Bucharest,news and politics,World"
"UK PM backs 'stop-and-search' power, says will create 10,000 more spaces in prisons","World-articles-txt/articles536txt","11 Aug 2019 02:12PM","UK,Boris Johnson,World"
"Typhoon Lekima death toll in eastern China rises to 32","World-articles-txt/articles537txt","11 Aug 2019 01:19PM","China,Typhoon Lekima,Asia"
"Liverpool star Mo Salah turns back to check on boy who ran into lamp-post","World-articles-txt/articles538txt","11 Aug 2019 12:59PM","World"
"'I was terrified': How Epstein allegedly built a network of victims","World-articles-txt/articles539txt","11 Aug 2019 07:20AM","hedge fund,Jeffrey Epstein,news and politics,Jennifer Araoz,World"
"North Korea says latest test was 'new weapon'","World-articles-txt/articles540txt","11 Aug 2019 06:50AM","North Korea,Kim Jong Un,KCNA,news and politics,Asia"
"Liver disease related to obesity and diabetes rising in US","World-articles-txt/articles541txt","15 Aug 2019 05:05AM","NAFLD,U.S.,Gut,health,obesity,US,World"
"Air pollution, especially ozone, tied to worsening lung damage","World-articles-txt/articles542txt","15 Aug 2019 05:05AM","U.S.,Joel Kaufman,medical health,JAMA,air pollution,Air,World"
"Poorer kids may have less shade in their schoolyards","World-articles-txt/articles543txt","15 Aug 2019 04:55AM","Joyce Pressley,U.S.,school district,home & garden,Jolee Potts,St Louis,World"
"Sierra Nevada chooses ULA's Vulcan to launch space station supply runs","World-articles-txt/articles544txt","15 Aug 2019 04:36AM","Vulcan rocket,Dream Chaser,space plane,cargo missions,International Space Station,World"
"Tunisia slashes field ahead of presidential poll","World-articles-txt/articles545txt","15 Aug 2019 04:29AM","Tunisia,presidential election,Beji Caid Essebsi,Zine El Abidine Ben Ali,World"
"Norway's first electric plane crash-lands on lake","World-articles-txt/articles546txt","15 Aug 2019 04:26AM","Norway,Avinor,battery-powered aircraft,crash-landed,World"
"US 'deeply concerned' by reports of Chinese paramilitary at Hong Kong border","World-articles-txt/articles547txt","15 Aug 2019 04:11AM","Hong Kong protests,Hong Kong,China,extradition bill,Asia"
"Yemen government rules out talks until separatists withdraw from Aden","World-articles-txt/articles548txt","15 Aug 2019 04:10AM","Yemen,separatists,Aden,Huthi rebels,World"
"With economic storm breaking, Argentina's Macri announces relief measures","World-articles-txt/articles549txt","15 Aug 2019 03:58AM","Argentina,Mauricio Macri,welfare subsidies,tax cuts,re-election,Business"
"Suspects in Slovak journalist's killing face more charges","World-articles-txt/articles550txt","15 Aug 2019 03:15AM","Slovak,journalist,Jan Kuciak,fiancee,Martina Kusnirova,World"
"After Brexit pledges, British PM Johnson announces cash injection for health","World-articles-txt/articles551txt","05 Aug 2019 12:40PM","Britain,European Union,Boris Johnson,World"
"Australia cancer sufferer first to use new assisted dying law","World-articles-txt/articles552txt","05 Aug 2019 12:15PM","Australia,Sydney,health,cancer,World"
"19 dead in car explosion in central Cairo","World-articles-txt/articles553txt","05 Aug 2019 11:36AM","Egypt,bombing,World"
"Single murder charge filed against Texas shooting suspect; case treated as domestic terrorism","World-articles-txt/articles554txt","05 Aug 2019 11:15AM","Donald Trump,United States,mass shootings,El Paso,World"
"Democrats aim their outrage at Trump after two mass shootings","World-articles-txt/articles555txt","05 Aug 2019 11:13AM","Donald Trump,United States,mass shootings,El Paso,World"
"New Zealand to decriminalise abortion laws, critics say Bill falls short","World-articles-txt/articles556txt","05 Aug 2019 11:01AM","New Zealand,abortion,Jacinda Ardern,World"
"Gun control won't prevent deadly shootings: Brazil's Bolsonaro","World-articles-txt/articles557txt","05 Aug 2019 10:59AM","Jair Bolsonaro,gun control,Brazil,news and politics,mass shootings,World"
"Canada deploys divers in search for fugitive teen murder suspects ","World-articles-txt/articles558txt","05 Aug 2019 07:09AM","Canada,divers,river,Manitoba,triple-murder,World"
"New migrant rescue ship leaves France on first mission off Libya","World-articles-txt/articles559txt","05 Aug 2019 06:52AM","Humanitarian group,SOS Mediterranee,rescue ship,Ocean Viking,Marseille,World"
"After shootings, under-fire Trump says 'hate has no place' in US","World-articles-txt/articles560txt","05 Aug 2019 06:34AM","mass shootings,Texas,Donald Trump,United States,World"
"Russian opposition activists picket for free elections","World-articles-txt/articles561txt","17 Aug 2019 09:32PM","Russia,politics,World"
"Italy prosecutors probe Salvini over migrant ship limbo","World-articles-txt/articles562txt","17 Aug 2019 08:51PM","Italy,news and politics,World"
"Beats replace bombs: Young Iraqis revel at summer festival","World-articles-txt/articles563txt","17 Aug 2019 08:45PM","Iraq,World"
"Civilian death toll mounts as Syrian offensive widens","World-articles-txt/articles564txt","17 Aug 2019 08:06PM","Syria,Russia,World"
"Hundreds of Mexican women protest police rape of teenager","World-articles-txt/articles565txt","17 Aug 2019 07:27PM","Mexico,news and politics,World"
"Nine hurt in accident at fireworks show in French resort","World-articles-txt/articles566txt","17 Aug 2019 06:58PM","France,World"
"Israeli warplanes hit Gaza after Palestinian rocket attack","World-articles-txt/articles567txt","17 Aug 2019 06:20PM","Gaza,Israel,Palestine,World"
"US issues warrant to seize Iranian tanker off Gibraltar","World-articles-txt/articles568txt","17 Aug 2019 06:06PM","Gibraltar,Iran,United States,news and politics,World"
"Pakistan, India exchange cross-border fire after UN meet on Kashmir","World-articles-txt/articles569txt","17 Aug 2019 05:45PM","Pakistan,Kashmir,India,World"
"Race to remember Berlin Wall victims, 30 years on","World-articles-txt/articles570txt","17 Aug 2019 05:30PM","Germany,Berlin Wall,running,World"
"In Greece's Aegean Sea, divers find 'gulf of plastic corals'","World-articles-txt/articles571txt","31 Jul 2019 10:47PM","Greece,Aegean Sea,pollution,plastic,World"
"Polish 'I am LGBT' campaign attracts tens of thousands of Twitter supporters","World-articles-txt/articles572txt","31 Jul 2019 10:31PM","Poland,LGBT,World"
"South Korea tests drone delivery in remote regions","World-articles-txt/articles573txt","31 Jul 2019 10:30PM","South Korea,technology,drones,World"
"Italy to release stranded migrants after EU deal reached","World-articles-txt/articles574txt","31 Jul 2019 10:02PM","Matteo Salvini,swiftly,Italy,Bruno Gregoretti,news and politics,World"
"China stakes claim to ASEAN 'neighbourhood' as Pompeo jets in for Bangkok talks","World-articles-txt/articles575txt","31 Jul 2019 09:26PM","trade war,China,free trade,Pompeo,ASEAN,Asia"
"Trump administration opens door to importing medicine from Canada","World-articles-txt/articles576txt","31 Jul 2019 09:21PM","Canada,U.S.,Trump administration,medical health,World"
"Pluristem gets positive results from radiation treatment trials","World-articles-txt/articles577txt","31 Jul 2019 08:21PM","ARS,medical health,acute radiation syndrome,Pluristem,Israel,World"
"Iran says prepared for dialogue if Saudi Arabia also ready","World-articles-txt/articles578txt","31 Jul 2019 07:28PM","Saudi Arabia,Iran,World"
"In Berlin, refugees get classes on sexual consent","World-articles-txt/articles579txt","31 Jul 2019 07:14PM","Berlin,Germany,World"
"Israel approves homes for Palestinians, settlers before Kushner visit","World-articles-txt/articles580txt","31 Jul 2019 07:04PM","Jerusalem,Israel,Palestine,World"
"Verdict for Salvadoran woman accused of killing stillborn expected next week","World-articles-txt/articles581txt","17 Aug 2019 04:57AM","El Salvador,World"
"Tobacco industry anti-smoking ads reached less than half of US adults","World-articles-txt/articles582txt","17 Aug 2019 04:20AM","U.S.,Sanjay Shete,Yale,health,Marina Picciotto,tobacco industry,World"
"Sick hospital workers often expose patients to contagious illness","World-articles-txt/articles583txt","17 Aug 2019 04:10AM","Canada,Reuters Health,contagious,health,Brenda Coleman,Toronto,World"
"UK's Johnson to meet Macron, Merkel next week","World-articles-txt/articles584txt","17 Aug 2019 02:51AM","Angela Merkel,Boris Johnson,France,World"
"Mexico does not want El Paso shooter executed","World-articles-txt/articles585txt","17 Aug 2019 02:12AM","El Paso,United States,Mexico,World"
"Iran tanker shifts position but still at anchor off Gibraltar","World-articles-txt/articles586txt","17 Aug 2019 02:11AM","Gibraltar,Iran,Grace 1,Tehran,World"
"Edwards Lifesciences, Medtronic heart valves win FDA approval for expanded use","World-articles-txt/articles587txt","17 Aug 2019 01:36AM","FDA,Medtronic,medical health,open-heart surgery,World"
"Tyson recalls nearly 40,000 pounds of Weaver chicken patties","World-articles-txt/articles588txt","17 Aug 2019 01:36AM","000,Weaver,U.S.,food & drink,Tyson,40,World"
"Deforestation in Brazil, vote in Argentina endanger EU-Mercosur pact","World-articles-txt/articles589txt","17 Aug 2019 01:31AM","Jair Bolsonaro,Argentina,Brazil,Amazon,World"
"Rashida Tlaib, fiery US lawmaker at center of Israel uproar","World-articles-txt/articles590txt","17 Aug 2019 01:01AM","Rashida Tlaib,Donald Trump,Israel,World"
"Johnson faces UK election test as Brexit battle looms","World-articles-txt/articles591txt","01 Aug 2019 11:28AM","Brexit,Britain,Boris Johnson,World"
"YouTube star Grant Thompson killed in paragliding accident","World-articles-txt/articles592txt","01 Aug 2019 10:35AM","YouTube,Grant Thompson,social media,death,accident,World"
"US rapper A$AP Rocky takes the stand in Sweden assault trial","World-articles-txt/articles593txt","01 Aug 2019 10:16AM","ASAP Rocky,Sweden,World"
"Palau tells Australia to step-up on climate","World-articles-txt/articles594txt","01 Aug 2019 09:42AM","business and finance,Palau,Australia,World"
"Brazil tribal chief's body to be exhumed for autopsy: Official ","World-articles-txt/articles595txt","01 Aug 2019 09:40AM","Brazil,news and politics,World"
"Peru's Vizcarra proposes early elections in April 2020","World-articles-txt/articles596txt","01 Aug 2019 09:38AM","news and politics,Peru,World"
"Be patient, top Republican senator tells Trump on North American trade deal","World-articles-txt/articles597txt","01 Aug 2019 09:35AM","United States,Donald Trump,news and politics,Business"
"Brazil's central bank cuts interest rates to record low","World-articles-txt/articles598txt","01 Aug 2019 09:30AM","business and finance,Brazil,Business"
"Trump offers Putin help with Siberian wildfires: Kremlin","World-articles-txt/articles599txt","01 Aug 2019 09:27AM","Vladimir Putin,Donald Trump,news and politics,Russia,World"
"US officials still hope for talks after latest North Korean missile tests","World-articles-txt/articles600txt","01 Aug 2019 09:24AM","United States,Donald Trump,Kim Jong Un,news and politics,North Korea,World"
"Nearly 1 in 3 Egyptians live below poverty line: State media","World-articles-txt/articles601txt","30 Jul 2019 06:35PM","Egypt,economy,World"
"China says 'most' inmates in Xinjiang camps are out","World-articles-txt/articles602txt","30 Jul 2019 06:27PM","'most,education,China,Xinjiang,Asia"
