"Turkey wants to expand Asian diplomatic ties: Foreign Minister","World-articles-txt/articles302txt","06 Aug 2019 01:07AM","Turkey,Asia,Mevlut Cavusoglu,diplomatic presence,economic centre,World"
"Egypt's Sisi calls deadly car blast 'terrorist incident'","World-articles-txt/articles303txt","06 Aug 2019 01:00AM","Khaled Megahed,Egypt,Abdel Fattah al-Sisi,speeding car,terrorist,World"
"US 'must condemn' white supremacy: Trump","World-articles-txt/articles304txt","05 Aug 2019 11:01PM","Donald Trump,gun violence,US,World"
"Russia reports ASF outbreak near its border with China","World-articles-txt/articles305txt","05 Aug 2019 10:20PM","agriculture,ASF,Primorsk,China,real estate,Russia,World"
"Trump urges gun background checks after mass shootings roil nation","World-articles-txt/articles306txt","05 Aug 2019 09:21PM","United States,Donald Trump,news and politics,shooting,World"
"Roche says test showed Tecentriq helped vs bladder cancer","World-articles-txt/articles307txt","05 Aug 2019 07:30PM","Roche,bladder cancer,news and politics,World"
"Nobio gets FDA approval for anti-bacterial dental fillings","World-articles-txt/articles308txt","05 Aug 2019 07:30PM","FDA,anti-bacterial,Nobio,medical health,U.S. Food and Drug Administration,Israel,World"
"Drug industry urges Canada to act early on US import plan","World-articles-txt/articles309txt","05 Aug 2019 07:15PM","Canada,lobby group,U.S.,medical health,IMC,World"
"July 2019 hottest month globally ever recorded: EU agency","World-articles-txt/articles310txt","05 Aug 2019 07:05PM","climate change,World"
"Facebook says it dismantles covert influence campaign tied to Saudi government","World-articles-txt/articles311txt","02 Aug 2019 09:43AM","Qatar,news and politics,Facebook,Saudi Arabia,World"
"Croatian police launch manhunt after 6 found shot dead","World-articles-txt/articles312txt","02 Aug 2019 09:27AM","news and politics,Croatia,World"
"Alaska boaters likely killed by falling glacier ice, officials say","World-articles-txt/articles313txt","02 Aug 2019 09:02AM","Valdez,Sheri Pierce,Europe,Alaska,news and politics,glacial,World"
"Latest Trump tariffs to directly hit consumers","World-articles-txt/articles314txt","02 Aug 2019 08:15AM","business and finance,broad-based,Donald Trump,retaliatory,China,Best Buy,Business"
"Explainer: Trump's China tariffs - paid by US importers, not by China","World-articles-txt/articles315txt","02 Aug 2019 08:05AM","US,Donald Trump,United States,China,Business"
"Rising calls for impeachment may not alter US House Democrats' course","World-articles-txt/articles316txt","02 Aug 2019 07:07AM","impeachment,Democrats,Congress,Donald Trump,Nancy Pelosi,World"
"Saudi Arabia allows women to travel without male 'guardian' approval","World-articles-txt/articles317txt","02 Aug 2019 06:54AM","Saudi Arabia,news and politics,women,World"
"Pentagon puts US$10 billion JEDI contract on hold after Trump suggests it favored Amazon","World-articles-txt/articles318txt","02 Aug 2019 06:45AM","business and finance,Donald Trump,Pentagon,Amazon,Business"
"Trump has 'no problem' with latest North Korean missile tests","World-articles-txt/articles319txt","02 Aug 2019 06:30AM","North Korea,missile tests,Security Council,denuclearisation,Kim Jong Un,Asia"
"US poised to formally abandon INF missile treaty","World-articles-txt/articles320txt","02 Aug 2019 06:24AM","INF,conventional,China,arms race,Russia,Ronald Reagan,World"
"Russia says INF arms treaty dead 'at the initiative of the US'","World-articles-txt/articles321txt","02 Aug 2019 05:08PM","Russia,United States,Cold War,World"
"No air strikes in northwest Syria as ceasefire declared: Monitor, rebel","World-articles-txt/articles322txt","02 Aug 2019 04:59PM","Syria,Russia,World"
"China warns of retaliation after Trump threatens fresh tariffs","World-articles-txt/articles323txt","02 Aug 2019 03:47PM","US-China trade war,US,China,trade,Asia"
"French drug smuggler's death sentence commuted in Indonesia","World-articles-txt/articles324txt","02 Aug 2019 02:50PM","drugs,Indonesia,Asia"
"Pompeo jabs at China's 'bad behaviour', defends US tariffs","World-articles-txt/articles325txt","02 Aug 2019 02:43PM","US-China trade war,US,China,trade,World"
"Witnesses to take stand in final day of A$AP Rocky assault trial","World-articles-txt/articles326txt","02 Aug 2019 01:42PM","Sweden,ASAP Rocky,World"
"From stickers to T-shirts, debate moments inspire US campaign merchandise","World-articles-txt/articles327txt","02 Aug 2019 10:30AM","Bernie Sanders,Joe Biden,news and politics,World"
"US eyes migration deals with rest of Central America after Guatemala's","World-articles-txt/articles328txt","02 Aug 2019 09:57AM","Central America,United States,Guatemala,World"
"Trump sticks with choice for spy chief despite apparent biographical embellishments","World-articles-txt/articles329txt","02 Aug 2019 09:48AM","US,Donald Trump,John Ratcliffe,World"
"Britain's Johnson suffers first electoral setback as PM","World-articles-txt/articles330txt","02 Aug 2019 09:43AM","Boris Johnson,UK,Britain,World"
"Do a Brexit deal, UK's Johnson tells Germany and France","World-articles-txt/articles331txt","19 Aug 2019 07:53PM","Prime Minister,Brexit,news and politics,Boris Johnson,France,Germany,World"
"Tensions spike as Turkish convoy enters northwest Syria","World-articles-txt/articles332txt","19 Aug 2019 07:14PM","Turkey,Idlib,Khan Sheikhun,religion & spirituality,Syria,Turkish,World"
"EU says ready for no-deal Brexit, 'British would be the biggest losers'","World-articles-txt/articles333txt","19 Aug 2019 06:52PM","United Kingdom,Brexit,Britain,World"
"For Trump, appeals to white fears about race may be a tougher sell in 2020","World-articles-txt/articles334txt","19 Aug 2019 06:24PM","US,Donald Trump,news and politics,analysis,World"
"Ebola spreads to remote, militia-run Congo territory","World-articles-txt/articles335txt","19 Aug 2019 05:40PM","Walikale,Rwanda,medical health,Uganda,Ebola,Congo,World"
"Kabul's glitzy wedding industry fears for future after attack","World-articles-txt/articles336txt","19 Aug 2019 05:34PM","Kabul,Afghanistan,terrorism,World"
"Victim's father hopes for justice as Cardinal Pell waits on appeal verdict","World-articles-txt/articles337txt","19 Aug 2019 05:29PM","George Pell,Catholic Church,Vatican,World"
"Ebola spreads 200km west to remote, militia-run Congo town","World-articles-txt/articles338txt","19 Aug 2019 05:26PM","Ebola,Congo,World"
"Sudan's ex-president Bashir in court for graft trial: AFP ","World-articles-txt/articles339txt","19 Aug 2019 05:23PM","Omar al Bashir,Sudan,World"
"Spain and Italy deal to disembark stranded migrants in Mallorca: Rescue ship","World-articles-txt/articles340txt","19 Aug 2019 05:08PM","Italy,Spain,Mallorca,migrants,World"
"Surgeons not good at predicting benefit from knee operations","World-articles-txt/articles341txt","16 Aug 2019 05:30AM","Netherlands,Utrecht,medical health,British Journal of Sports Medicine,physical therapy,Odense,World"
"Virgin Galactic unveils new Mission Control for space tourism","World-articles-txt/articles342txt","16 Aug 2019 05:08AM","Space tourism,Virgin Galactic,Mission Control,World"
"Palestinian youths stab Israeli policeman, one youth shot dead","World-articles-txt/articles343txt","16 Aug 2019 03:53AM","Palestinian youths,Jerusalem,Old City,policeman,World"
"Roche's personalized cancer treatment wins FDA approval","World-articles-txt/articles344txt","16 Aug 2019 03:50AM","cancer treatment,FDA,Roche,medical health,Rozlytrek,World"
"Israel bars visit by two US congresswomen after Trump's call","World-articles-txt/articles345txt","16 Aug 2019 03:46AM","Israel,Ilhan Omar,United States,World"
"Furniture flame retardants may not stifle deadliest home fires","World-articles-txt/articles346txt","16 Aug 2019 03:35AM","Reuters Health,Kathryn Rodgers,U.S.,furniture,Massachusetts,news and politics,World"
"July 2019 hottest month on record for planet: US agency","World-articles-txt/articles347txt","16 Aug 2019 02:56AM","weather,climate change,World"
"Trump expected to defend handling of US economy at New Hampshire rally","World-articles-txt/articles348txt","16 Aug 2019 02:09AM","Donald Trump,New Hampshire,US economy,recession fears,Business"
"Does North Korea's Kim get Trump's tweet alerts?","World-articles-txt/articles349txt","16 Aug 2019 02:03AM","radio programme,South Korea,Donald Trump,Kim Jong Un,twitter,Asia"
"Surgical training programs not supportive of new parents","World-articles-txt/articles350txt","16 Aug 2019 12:36AM","careers,ABS,Surgical,U.S.,Maria Altieri,parental leave,World"
"Norway detects radioactive iodine by Russian border days after blast","World-articles-txt/articles351txt","15 Aug 2019 06:42PM","Norway,health,iodine,Russia,World"
"US scientist to file whistleblower complaint after agency halts his climate work","World-articles-txt/articles352txt","15 Aug 2019 06:34PM","George Luber,science,health,Donald Trump,climate change,whistleblowing,World"
"Irish airport flights suspended after runway plane fire","World-articles-txt/articles353txt","15 Aug 2019 06:21PM","Ireland,aviation,World"
"Suspect in Philadelphia shooting standoff taken into custody","World-articles-txt/articles354txt","15 Aug 2019 06:06PM","Philadelphia,gun,Unites States,World"
"Strong winds fan fierce wildfire in southern France","World-articles-txt/articles355txt","15 Aug 2019 06:04PM","fire,France,World"
"United States seeks to seize the Iranian vessel in Gibraltar: Report","World-articles-txt/articles356txt","15 Aug 2019 05:45PM","Gibraltar,Iran,United States,World"
"Russia warns China it could ban timber exports over illegal logging","World-articles-txt/articles357txt","15 Aug 2019 05:37PM","Beijing,Russia,China,World"
"Spain to take some migrants on Open Arms ship, says Italy","World-articles-txt/articles358txt","15 Aug 2019 05:27PM","Rome,territorial,willingness,Italy,news and politics,Spain,World"
"EU water bombers join Greek firemen to douse island wildfire","World-articles-txt/articles359txt","15 Aug 2019 04:50PM","Greece,fire,World"
"Jeffrey Epstein autopsy report shows broken neck: Washington Post","World-articles-txt/articles360txt","15 Aug 2019 04:43PM","Jeffrey Epstein,World"
"Bulgaria seizes cocaine smuggled in banana shipment","World-articles-txt/articles361txt","18 Aug 2019 01:56AM","Bulgaria,World"
"Yemeni separatists quit some Aden posts; Houthis attack Saudi oil plant","World-articles-txt/articles362txt","18 Aug 2019 01:37AM","Saudi Arabia,Yemen,World"
"EU's Juncker cuts holiday short for urgent surgery","World-articles-txt/articles363txt","18 Aug 2019 01:36AM","Jean-Claude Juncker,European Union,World"
"Suspect in New York City subway scare apprehended by police","World-articles-txt/articles364txt","18 Aug 2019 01:35AM","New York City,World"
"Reluctant Salvini says OK for minors to leave Italy migrant ship","World-articles-txt/articles365txt","18 Aug 2019 12:48AM","Matteo Salvini,Giuseppe Conte,Italy,World"
"Crowds fill Khartoum's streets to hail 'new Sudan'","World-articles-txt/articles366txt","18 Aug 2019 12:22AM","Khartoum,Sudan,World"
"EU's Juncker cuts holiday short for urgent surgery","World-articles-txt/articles367txt","17 Aug 2019 11:56PM","European Union,World"
"Charity ship says migrants' safety at risk; Italy to allow minors off","World-articles-txt/articles368txt","17 Aug 2019 11:51PM","Italy,news and politics,World"
"EU calls for 'inclusive dialogue' over Hong Kong tensions","World-articles-txt/articles369txt","17 Aug 2019 11:29PM","Hong Kong,European Union,Hong Kong protests,Asia"
"Wildlife summit mulls trade rules to counter 'unprecedented' species declines","World-articles-txt/articles370txt","17 Aug 2019 09:48PM","CITES,animals,endangered species,World"
"Defying Congress, Trump administration looks to shift billions in foreign aid","World-articles-txt/articles371txt","07 Aug 2019 07:08AM","Congress,Donald Trump,foreign aid,Lindsey Graham,World"
"Cuba to defend itself in US court over ExxonMobil lawsuit","World-articles-txt/articles372txt","07 Aug 2019 07:01AM","ExxonMobil,Cuba,Fidel Castro,Cuba-Petroleo,Cimex,Business"
"Commentary: Meet Sofia, the 67-year-old widow who uses Pokemon Go to fight depression","World-articles-txt/articles373txt","07 Aug 2019 06:28AM","Pokemon Go,mobile games,elderly,digital health,technology,Commentary"
"Commentary: On the trade war, China's pain is not necessarily America's gain","World-articles-txt/articles374txt","07 Aug 2019 06:28AM","China,United States,US China trade war,Donald Trump,Commentary"
"Drug assistance programs offer little charity to uninsured","World-articles-txt/articles375txt","07 Aug 2019 06:00AM","U.S.,Gerard Anderson,medical health,JAMA,assistance,Katherine Kraschel,World"
"Walgreens to close about 200 stores in United States","World-articles-txt/articles376txt","07 Aug 2019 05:31AM","business and finance,U.S.,United States,pre-tax,Deerfield,UK Boots,World"
"FBI opens domestic terror investigation into California mass shooting","World-articles-txt/articles377txt","07 Aug 2019 05:24AM","California,domestic terrorism,Santino William Legan,FBI,food festival,World"
"US senators want Poland to pay Jews for Nazi property thefts","World-articles-txt/articles378txt","07 Aug 2019 05:20AM","US senators,Warsaw,restitution,Poland,Mike Pompeo,property thefts,World"
"Cancer hospital affiliation tied to lower cancer surgery mortality rates","World-articles-txt/articles379txt","07 Aug 2019 04:01AM","Daniel Boffa,U.S.,New Haven,JAMA Oncology,medical health,mortality rate,World"
"Medical professionals of both genders link the word ""career"" with men","World-articles-txt/articles380txt","07 Aug 2019 03:36AM","Reuters Health,U.S.,health,Arghavan Salles,family medicine,Jennifer Sheridan,World"
"Aircraft used to carry US troops catches fire at Irish airport: Report","World-articles-txt/articles381txt","15 Aug 2019 04:32PM","plane,aircraft,airport,World"
"'Hate will not overcome love', El Paso shooting memorial attendees told","World-articles-txt/articles382txt","15 Aug 2019 03:50PM","Walmart,El Paso,World"
"Russians hail 'hero' pilot after Moscow emergency landing","World-articles-txt/articles383txt","15 Aug 2019 03:36PM","air transport,Moscow,Russia,World"
"Mexico's top court demands regulation on medical marijuana after long delays","World-articles-txt/articles384txt","15 Aug 2019 10:45AM","medical marijuana,Mexico,news and politics,World"
"Mexico to penalise creators of TV series seen as 'dirty campaign' against president","World-articles-txt/articles385txt","15 Aug 2019 10:07AM","Mexico,World"
"Republican lawmaker questions if humans would have survived without rape, incest","World-articles-txt/articles386txt","15 Aug 2019 09:03AM","World"
"Employees urge Google not to work with US immigration officials","World-articles-txt/articles387txt","15 Aug 2019 08:54AM","Google,World"
"Man accused of New Zealand mosque attacks seeks to move trial from Christchurch","World-articles-txt/articles388txt","15 Aug 2019 08:50AM","Christchurch shootings,World"
"Samoans ink painful bond with their motherland","World-articles-txt/articles389txt","15 Aug 2019 08:45AM","Samoa,World"
"Global stocks hurt by China's trade threats, falling bond yields","World-articles-txt/articles390txt","15 Aug 2019 08:40AM","business and finance,U.S.,Fed,yield curve,China,Business"
"US move to resume death penalty bucks trend: UN","World-articles-txt/articles391txt","30 Jul 2019 10:37PM","Rupert Colville,Justice Department,death penalty,UN,news and politics,Trump,World"
"'Presenteeism' takes toll on menstruating women: Survey","World-articles-txt/articles392txt","30 Jul 2019 10:22PM","women,health,World"
"Sudan's military rulers say El-Obeid killings unacceptable, due to address nation","World-articles-txt/articles393txt","30 Jul 2019 10:13PM","Sudan,Abdel Fattah al-Burhan,World"
"Outcry in Spain over tributes to freed ETA prisoners","World-articles-txt/articles394txt","30 Jul 2019 10:11PM","ETA,news and politics,Spain,World"
"Two shot dead in Mississippi Walmart: Media","World-articles-txt/articles395txt","30 Jul 2019 10:07PM","United States,Mississippi,shootings,gun crime,World"
"Washington denies it plans to quit nuclear test ban treaty","World-articles-txt/articles396txt","30 Jul 2019 09:49PM","US,nuclear arms,Russia,World"
"Trump says he wants 'a large cut' from US Federal Reserve","World-articles-txt/articles397txt","30 Jul 2019 09:43PM","Donald Trump,US Federal Reserve,World"
"UK's Johnson promises Irish PM no physical border checks","World-articles-txt/articles398txt","30 Jul 2019 09:11PM","news and politics,UK,Boris Johnson,Brexit,Ireland,World"
"US formally asks Germany to join Hormuz mission: Berlin Embassy","World-articles-txt/articles399txt","30 Jul 2019 09:03PM","United States,Iran,Berlin,France,Germany,Britain,World"
"Body of French man missing since police raid found: Source","World-articles-txt/articles400txt","30 Jul 2019 08:41PM","Nantes,Steve Canico,news and politics,Loire,France,World"
"Philippine military warns on Chinese investment in key islands","World-articles-txt/articles401txt","07 Aug 2019 12:26AM","China,Philippine military,Edgard Arevalo,Rodrigo Duterte,Chinese investors,strategic islands,Asia"
"Amag's female libido injectable therapy to sell at US$899","World-articles-txt/articles402txt","07 Aug 2019 12:26AM","injectable,Addyi,medical health,Vyleesi,Amag,World"
"Palin can pursue defamation case against NY Times: US appeals court","World-articles-txt/articles403txt","06 Aug 2019 11:45PM","defamation,Sarah Palin,New York Times,mass shooting,Gabrielle Giffords,World"
"Football: Chelsea staff 'turned blind eye' to sexual abuse","World-articles-txt/articles404txt","06 Aug 2019 11:39PM","Premier League,Chelsea,Eddie Heath,chief scout,sexual assaults,Sport"
"Brazil inmate found dead after foiled escape disguised as daughter","World-articles-txt/articles405txt","06 Aug 2019 10:38PM","Brazil,crime,World"
"US to announce 'sweeping steps' at big meeting on Venezuela","World-articles-txt/articles406txt","06 Aug 2019 09:50PM","Venezuela,news and politics,United States,World"
"Trump wants trade pact with China but must be 'right deal': White House adviser","World-articles-txt/articles407txt","06 Aug 2019 09:43PM","White House,trade,US-China trade war,World"
"8chan founder hopes El Paso shooting 'final nail in coffin'","World-articles-txt/articles408txt","06 Aug 2019 09:35PM","movies,8chan,El Paso,Fredrick Brennan,mass shooting,World"
"Police recommend charging Israeli deputy minister in Australia extradition case","World-articles-txt/articles409txt","06 Aug 2019 09:23PM","news and politics,Israel,Australia,World"
"Rescue trauma haunts Mediterranean migrant rescuers","World-articles-txt/articles410txt","06 Aug 2019 09:12PM","news and politics,World"
"US House panel to cut recess short to consider gun measures","World-articles-txt/articles411txt","17 Aug 2019 05:13PM","United States,shooting,news and politics,World"
"Hundreds attend El Paso memorial for shooting victim with few family","World-articles-txt/articles412txt","17 Aug 2019 05:00PM","United states,shooting,news and politics,World"
"Hong Kong protest tensions heat up in Australia","World-articles-txt/articles413txt","17 Aug 2019 04:16PM","Hong Kong,China,news and politics,Australia,Hong Kong protests,Asia"
"Greenland isn't for sale but it is increasingly valuable","World-articles-txt/articles414txt","17 Aug 2019 10:17AM","polar,business and finance,China,Denmark,Greenland,Washington,World"
"Fiji PM labels Australia PM 'very insulting' after Pacific forum standoff","World-articles-txt/articles415txt","17 Aug 2019 10:04AM","Pacific Island Forum,climate change,World"
"Mexico detains US 'Islamist' at migrant center","World-articles-txt/articles416txt","17 Aug 2019 06:46AM","Mexico,Interpol,World"
"Fitch downgrades Argentina's debt to 'CCC' on rising uncertainty","World-articles-txt/articles417txt","17 Aug 2019 06:26AM","Argentina,Business"
"Commentary: Why this US-China trade war is harder to resolve","World-articles-txt/articles418txt","17 Aug 2019 06:02AM","US China trade war,global economy,global recession,China,Commentary"
"As Americans get heavier, obesity-linked cancers may strike earlier","World-articles-txt/articles419txt","17 Aug 2019 05:20AM","Siran Koroukian,Daniel Labow,Yuan,health,Ohio,obesity,World"
"Official autopsy concludes Epstein death's was suicide by hanging","World-articles-txt/articles420txt","17 Aug 2019 05:16AM","Jeffrey Epstein,Chief Medical Examiner,World"
"Power crisis turns night into day for Zimbabwe's firms and families","World-articles-txt/articles421txt","01 Aug 2019 11:11PM","industrial park,business and finance,Moses Chipurura,Zimbabwe,World"
"English town evacuated after water cascades through damaged dam","World-articles-txt/articles422txt","01 Aug 2019 11:07PM","Britain,England,World"
"Amazon chief Bezos cashes in US$1.8 billion of share pile","World-articles-txt/articles423txt","01 Aug 2019 11:06PM","Jeff Bezos,Amazon,Business"
"Search for new IMF head widens to include British candidate","World-articles-txt/articles424txt","01 Aug 2019 10:52PM","Europe,Britain,International Monetary Fund,Business"
"Chinese envoy in New Zealand lauds students in anti-Hong Kong scuffle","World-articles-txt/articles425txt","01 Aug 2019 10:42PM","China,Hong Kong,Hong Kong protests,New Zealand,Auckland,University of Auckland,Asia"
"Audio reveals Ronald Reagan calling African delegates 'monkeys'","World-articles-txt/articles426txt","01 Aug 2019 09:48PM","Ronald Reagan,United States,World"
"Russian police arrest five in crackdown before opposition protest","World-articles-txt/articles427txt","01 Aug 2019 09:27PM","Russia,World"
"Thailand set to deliver first batch of medical marijuana","World-articles-txt/articles428txt","01 Aug 2019 08:48PM","Withoon Danwiboon,GPO,cannabis,medical health,Thailand,World"
"Dutch ban on burqas in public places takes effect","World-articles-txt/articles429txt","01 Aug 2019 08:35PM","Netherlands,burqa,niqab,Muslim,Geert Wilders,World"
"Ebola: Profile of a killer","World-articles-txt/articles430txt","01 Aug 2019 08:24PM","Ebola,disease,health,World"
"Magnitude 6.8 quake strikes off Chile, no damage reported","World-articles-txt/articles431txt","02 Aug 2019 04:16AM","Chile,earthquake,US Geological Survey,World"
"Maker of gun used in Sandy Hook massacre asks Supreme Court to block lawsuit","World-articles-txt/articles432txt","02 Aug 2019 03:23AM","assault-style,Newton,Sandy Hook,Connecticut,Remington,World"
"US to slap 10% tariff on another US$300b in Chinese goods","World-articles-txt/articles433txt","02 Aug 2019 03:07AM","Donald Trump,China,tariffs,trade war,fentanyl,Business"
"Poles pay homage 75 years since Warsaw Uprising","World-articles-txt/articles434txt","02 Aug 2019 02:59AM","Poland,air-raid sirens,Warsaw Uprising,Nazi German,World"
"Iran says it's ready for worst in battle to save nuclear deal in standoff with US","World-articles-txt/articles435txt","02 Aug 2019 02:41AM","Iran,Hassan Rouhani,nuclear deal,Middle East,World"
"Pandemic bonds face scrutiny after Ebola outbreak yet to trigger payout","World-articles-txt/articles436txt","02 Aug 2019 02:35AM","Michael Bennett,World Bank,news and politics,scrutiny,World"
"Potentially habitable planet found in new solar system","World-articles-txt/articles437txt","02 Aug 2019 02:07AM","astronomers,solat system,planet,habitable,Rafael Luque,World"
"Russia to investigate if Siberia wildfires were started deliberately","World-articles-txt/articles438txt","02 Aug 2019 01:56AM","Dmitry Medvede,Siberia,wildfires,illegal logging,World"
"World will lose brake on nuclear war with end of INF treaty: UN chief","World-articles-txt/articles439txt","02 Aug 2019 01:52AM","INF,nuclear war,Antonio Guterres,World"
"Turtle embryos play a part in determining own sex","World-articles-txt/articles440txt","02 Aug 2019 01:45AM","turtle,temperature,eggs,offspring,climate change,World"
"French 'flyboard' daredevil to make new Channel bid","World-articles-txt/articles441txt","31 Jul 2019 02:04AM","Franky Zapata,flyboard,English channel,Sangatte,World"
"Britain's Prince Harry speaks out on 'unconscious' racism bias","World-articles-txt/articles442txt","31 Jul 2019 01:41AM","racism,Prince Harry,Jane Goodall,Vogue magazine,Meghan,World"
"US urges Germany to help secure Strait of Hormuz","World-articles-txt/articles443txt","31 Jul 2019 01:36AM","Iran,Strait of Hormuz,Germany,World"
"Questions mount as body found of Frenchman missing since music festival","World-articles-txt/articles444txt","31 Jul 2019 01:12AM","Nantes,France,River Loire,Steve Maia Canico,techno music,concert,World"
"Exclusive: Two powerful Canadian provinces argued against federal drug price crackdown","World-articles-txt/articles445txt","31 Jul 2019 01:06AM","Canada,business and finance,federal government,Quebec,Ontario,World"
"Dubai ruler's wife seeks UK forced marriage protection order for children","World-articles-txt/articles446txt","31 Jul 2019 01:01AM","Dubai,protection order,Princess Haya,United Arab Emirates,World"
"Romania's interior minister resigns over teen murder outcry","World-articles-txt/articles447txt","31 Jul 2019 12:54AM","Romania,interior minister,Nicolae Moga,murder,teenage girl,Gheorghe Dinca,World"
"Ukraine seizes Russian tanker over naval clash","World-articles-txt/articles448txt","31 Jul 2019 12:49AM","Ukraine,Russian tanker,naval clash,Nika Spirit,Odessa,World"
"Fourth Bulgarian pig farm hit by African swine fever","World-articles-txt/articles449txt","31 Jul 2019 12:30AM","pets,swine,Silistra,Popina,World"
"Notre-Dame toxic fallout lawsuit turns heat on Paris authorities","World-articles-txt/articles450txt","31 Jul 2019 12:16AM","Notre-Dame,cathedral,Paris,environmental,lead poisoning,World"
"Families of Kashmir detainees in dark about where or why they are locked up","World-articles-txt/articles451txt","14 Aug 2019 11:27PM","Kashmir,politics,India,South Asia,World"
